{
  "$schema": "https://json-schema.org/draft/2020-12/schema",
  "title": "CrabLink Passport Bootstrap Response",
  "type": "object",
  "additionalProperties": true,
  "required": [
    "schema",
    "passport",
    "capabilities",
    "warnings"
  ],
  "properties": {
    "schema": {
      "type": "string",
      "const": "crablink.identity.bootstrap.v1"
    },
    "passport": {
      "$ref": "#/$defs/passport"
    },
    "wallet": {
      "anyOf": [
        {
          "$ref": "#/$defs/wallet"
        },
        {
          "type": "null"
        }
      ]
    },
    "starter_grant": {
      "anyOf": [
        {
          "$ref": "#/$defs/starter_grant"
        },
        {
          "type": "null"
        }
      ]
    },
    "capabilities": {
      "$ref": "#/$defs/capabilities"
    },
    "warnings": {
      "type": "array",
      "items": {
        "type": "string"
      }
    }
  },
  "$defs": {
    "passport": {
      "type": "object",
      "additionalProperties": true,
      "required": [
        "subject",
        "kind",
        "display_name",
        "source"
      ],
      "properties": {
        "subject": {
          "type": "string",
          "minLength": 1
        },
        "kind": {
          "type": "string",
          "minLength": 1
        },
        "display_name": {
          "type": "string"
        },
        "created_at": {
          "type": [
            "string",
            "null"
          ]
        },
        "source": {
          "type": "string"
        },
        "requested_username": {
          "type": "string"
        },
        "requested_handle": {
          "type": "string"
        },
        "username": {
          "type": "string"
        },
        "handle": {
          "type": "string"
        },
        "username_status": {
          "type": "string",
          "enum": [
            "local_draft",
            "requested",
            "confirmed",
            "rejected",
            "unavailable",
            "backend_unknown"
          ]
        },
        "profile_crab_url": {
          "type": [
            "string",
            "null"
          ]
        },
        "public_profile_cid": {
          "type": [
            "string",
            "null"
          ],
          "pattern": "^$|^b3:[0-9a-f]{64}$"
        }
      }
    },
    "wallet": {
      "type": "object",
      "additionalProperties": true,
      "required": [
        "account",
        "linked",
        "source"
      ],
      "properties": {
        "account": {
          "type": "string",
          "minLength": 1
        },
        "linked": {
          "type": "boolean"
        },
        "source": {
          "type": "string"
        }
      }
    },
    "starter_grant": {
      "type": "object",
      "additionalProperties": true,
      "required": [
        "issued",
        "amount_minor_units"
      ],
      "properties": {
        "issued": {
          "type": "boolean"
        },
        "amount_minor_units": {
          "type": "string",
          "pattern": "^[0-9]+$"
        },
        "receipt_id": {
          "type": [
            "string",
            "null"
          ]
        },
        "reason": {
          "type": [
            "string",
            "null"
          ]
        },
        "ledger_backed": {
          "type": "boolean"
        },
        "source": {
          "type": "string"
        }
      }
    },
    "capabilities": {
      "type": "object",
      "additionalProperties": true,
      "required": [
        "can_view_balance",
        "can_prepare_paid_actions",
        "can_spend"
      ],
      "properties": {
        "can_view_balance": {
          "type": "boolean"
        },
        "can_prepare_paid_actions": {
          "type": "boolean"
        },
        "can_spend": {
          "type": "boolean",
          "const": false
        }
      }
    }
  }
}