{
  "schema": "crablink.identity.bootstrap.v1",
  "passport": {
    "subject": "passport:main:dev",
    "kind": "main",
    "display_name": "CrabLink main passport",
    "created_at": null,
    "source": "omnigate_dev_bootstrap"
  },
  "wallet": {
    "account": "acct_dev",
    "linked": true,
    "source": "omnigate_dev_bootstrap"
  },
  "starter_grant": {
    "issued": true,
    "amount_minor_units": "1776",
    "receipt_id": "tx_1776_demo_receipt",
    "reason": "issued_by_svc_wallet",
    "ledger_backed": true,
    "source": "svc_wallet.v1"
  },
  "capabilities": {
    "can_view_balance": true,
    "can_prepare_paid_actions": true,
    "can_spend": false
  },
  "warnings": [
    "dev bootstrap returns passport labels until svc-passport custody is wired",
    "wallet spend authority is not granted by this response"
  ]
}